{
  "schema": "https://profile-atoms.com/schemas/profile-atom-v1.json",
  "canonical_name": "independent/profiles/non-fiction-author",
  "version": "1.0.0",
  "authored_by": "personal-author-key",
  "description": "Non-fiction author working on long-form narrative with personal research substrate, voice consistency, and citation discipline. Illustrative profile from the v1.0.0 design — same logical schema as jmfamily-developer, completely different domain. References are placeholders until referenced catalogs are populated.",
  "role_packs": [
    { "ref": "community/role-packs/researcher",        "version": "1.0.0", "priority": 1 },
    { "ref": "community/role-packs/author-nonfiction", "version": "1.0.0", "priority": 2 }
  ],
  "policy_stack": [
    { "ref": "independent/policies/citation-required",    "version": "1.0.0" },
    { "ref": "independent/policies/voice-consistency",    "version": "1.0.0" },
    { "ref": "community/policies/fact-check-floor",       "version": "1.0.0" }
  ],
  "governance_stack": [
    { "ref": "community/governance/personal-creative-work", "version": "1.0.0" }
  ],
  "default_persona": { "ref": "community/personas/thoughtful-collaborator", "version": "1.0.0" },
  "default_theme":   { "ref": "community/themes/writers-warm",              "version": "1.0.0" },
  "default_budget": {
    "per_action":  0.5,
    "per_session": 25,
    "per_day":     100,
    "on_cap_hit":  "warn"
  },
  "available_identities": [
    { "ref": "independent/identities/personal-author", "version": "1.0.0" }
  ],
  "available_channels": [
    { "ref": "convergent-systems/channels/anthropic-api",  "version": "1.0.0" },
    { "ref": "olympus/channels/ollama-local",              "version": "1.0.0" },
    { "ref": "community/channels/google-scholar",          "version": "1.0.0" },
    { "ref": "community/channels/wikipedia-research",      "version": "1.0.0" },
    { "ref": "community/channels/jstor",                   "version": "1.0.0" },
    { "ref": "community/channels/internet-archive",        "version": "1.0.0" },
    { "ref": "community/channels/zotero-local",            "version": "1.0.0" },
    { "ref": "olympus/channels/git-local",                 "version": "1.0.0" }
  ],
  "knowledge_sources": [
    { "ref": "community/knowledge/chicago-manual-of-style", "version": "17.0.0" },
    { "ref": "community/knowledge/nonfiction-conventions",  "version": "1.0.0" },
    { "ref": "independent/knowledge/my-book-research-corpus", "version": "0.3.0" },
    { "ref": "independent/knowledge/my-style-samples",        "version": "0.1.0" }
  ],
  "default_workflows": [
    { "ref": "community/workflows/draft-section-with-citations", "version": "1.0.0" },
    { "ref": "community/workflows/literature-review",            "version": "1.0.0" },
    { "ref": "community/workflows/voice-consistency-check",      "version": "1.0.0" },
    { "ref": "community/workflows/fact-check-pass",              "version": "1.0.0" }
  ],
  "update_policy": {
    "auto_upgrade":       true,
    "notification":       true,
    "diff_visualization": "optional"
  },
  "trust_requirements": {
    "role_packs":  { "must_be_signed_by_any_of": ["community-curator-key", "olympus-official-key"] },
    "policies":    { "must_be_signed_by_any_of": ["personal-author-key", "community-curator-key"] },
    "governance":  { "must_be_signed_by_any_of": ["community-curator-key"] },
    "identities":  { "must_be_signed_by": "personal-author-key" },
    "knowledge":   { "must_be_signed_by_any_of": ["personal-author-key", "community-curator-key"] }
  }
}
